id,title,description,theme,speaker,speakerBio,eventDate,startDate,endDate,duration,meetingLink,youtubeLink,cardImageUrl,cardImageKey,programId,targetAudience,status,reminderSent,reminderSentAt,createdBy,createdAt,updatedAt
120001,2026/06 - Aula 04 - Resiliência e Proatividade na Prática Organizacional,"No encontro final do curso Resiliência e Proatividade na Prática Organizacional, será realizada uma síntese dos principais aprendizados das aulas anteriores, integrando dois pilares fundamentais para o desenvolvimento profissional em ambientes organizacionais desafiadores: equilíbrio emocional diante da pressão e capacidade de antecipar riscos e agir preventivamente.
A aula aborda como a combinação entre resiliência e proatividade contribui para o desenvolvimento da maturidade profissional, fortalecendo a tomada de decisões, a comunicação responsável e a construção de credibilidade no ambiente de trabalho.
Durante o encontro, os participantes serão convidados a refletir sobre situações reais de pressão em seu contexto profissional e a estruturar um Plano de Desenvolvimento de 30 dias, com ações práticas para aplicar os conceitos aprendidos no dia a dia.
Este momento de integração consolida as competências trabalhadas ao longo do curso e reforça uma mensagem central: profissionais que mantêm equilíbrio diante das dificuldades e agem antes que os problemas se tornem crises tornam-se referências em suas organizações.",Integração: Resiliência + Produtividade = Maturidade.,Sandra Pitman,"Sandra Pitman é psicóloga, especialista em Carreira Executiva e Desenvolvimento de Lideranças, com mais de 35 anos de atuação na área de Recursos Humanos.
Possui MBA em Coaching e formação em Executive, Career e Positive Coaching pela Sociedade Brasileira de Coaching, além de especialização em coordenação de processos de grupo. Atua desde 1996 em projetos de Mudança Organizacional, Treinamento e Desenvolvimento, Avaliação de Desempenho e Potencial, Assessment e Coaching Executivo.
Ao longo de sua trajetória, conduziu projetos para empresas como Banco Safra, Cargill, Nestlé, Itaú, Claro, Coca-Cola, CPFL, Alpargatas, entre outras, com foco em desenvolvimento de pessoas, cultura organizacional e fortalecimento da performance profissional",2026-03-25 14:00:00,2026-03-25 14:00:00,2026-03-25 15:00:00,60,https://www.even3.com.br/202606-aula-04-Integracao-704241,https://www.youtube.com/watch?v=5REu49iK7XQ,https://d2xsxph8kpxj0f.cloudfront.net/310519663192322263/5n7arrGNHjNdoFCMzyGXcY/webinar-cards/webinar-120001-w5e98v1m.jpeg,webinar-cards/webinar-120001-w5e98v1m.jpeg,,all,published,1,2026-03-19 20:15:50,1,2026-03-19 19:00:54,2026-03-19 20:33:43
